<!ELEMENT agenda (contacto*)>

<!ELEMENT contacto (nombre, direccion, ciudad, provincia, cp, numeros, email, web, companya)>

<!ELEMENT nombre (#PCDATA)>
<!ELEMENT direccion (#PCDATA)>
<!ELEMENT ciudad (#PCDATA)>
<!ELEMENT provincia (#PCDATA)>
<!ELEMENT cp (#PCDATA)>

<!ELEMENT numeros (telefono, fax)>

    <!ELEMENT telefono (#PCDATA)>
    <!ELEMENT fax (#PCDATA)>

<!ELEMENT email (#PCDATA)>
<!ELEMENT web (#PCDATA)>
<!ELEMENT companya (#PCDATA)>
